{"operation":"DATASET_TRANSFORM","inputArtifacts":[{"artifactId":"00000000-0000-4000-8000-000000000103","artifactClass":"RAW","role":"INPUT","key":"raw/sha256/44/44/4444444444444444444444444444444444444444444444444444444444444444/payload","mediaType":"text/csv","byteLength":4096,"checksumAlgorithm":"SHA256","checksum":"4444444444444444444444444444444444444444444444444444444444444444","immutable":true,"createdAt":"2026-07-15T00:00:00.000Z"}],"outputStagingPrefix":"staging/00000000-0000-4000-8000-000000000303/00000000-0000-4000-8000-000000000403","inputFormat":"CSV","targetFormat":"PARQUET","schemaMode":"INFER_AND_REPORT","declaredSchemaArtifact":null,"encodingHint":"UTF-8","csvOptions":{"delimiter":",","hasHeader":true,"quote":"\""},"sheetSelection":null,"columnSelection":null,"providerOptions":{}}
